{
  "_generated": "GENERATED — do not hand-edit. figma-synced 2026-10-21T12:25:27.000Z; regenerated by atlas-figma-sync.",
  "syncedAt": "2026-10-21T12:25:27.000Z",
  "figmaVersion": "lib:Atlas Design System v1@2026-07-06T03:44:45Z",
  "note": "Machine-readable twin of index.md. Open a component's doc or metadata only when you will use it.",
  "components": [
    {
      "name": "Button",
      "tier": "primitives",
      "status": "stable",
      "import": "@atlas/ui-web/primitives/Button/Button",
      "variants": ["primary", "secondary", "outline", "ghost", "destructive", "link"],
      "sizes": ["xs", "sm", "md", "lg"],
      "use": "Submitting a form, confirming or cancelling, or opening a dialog.",
      "notUse": "Navigating to another page or route → a link (variant=\"link\" only styles an anchor; use asChild with the router link).",
      "doc": "atlas/Button.md",
      "metadata": "atlas/metadata/Button.json"
    },
    {
      "name": "Input",
      "tier": "primitives",
      "status": "stable",
      "import": "@atlas/ui-web/primitives/Input/Input",
      "variants": ["default", "filled", "unstyled"],
      "sizes": ["sm", "md", "lg"],
      "use": "Collecting one line of text, email, number, search or password.",
      "notUse": "Multi-line text → Textarea.",
      "doc": "atlas/Input.md",
      "metadata": "atlas/metadata/Input.json"
    },
    {
      "name": "Label",
      "tier": "primitives",
      "status": "stable",
      "import": "@atlas/ui-web/primitives/Label/Label",
      "variants": ["default", "inline"],
      "sizes": ["sm", "md", "lg"],
      "use": "Naming any Input, Textarea or Select, stacked above or beside it.",
      "notUse": "Writing a heading or legend → a heading element.",
      "doc": "atlas/Label.md",
      "metadata": "atlas/metadata/Label.json"
    },
    {
      "name": "Textarea",
      "tier": "primitives",
      "status": "stable",
      "import": "@atlas/ui-web/primitives/Textarea/Textarea",
      "variants": ["default", "filled", "unstyled"],
      "sizes": ["sm", "md", "lg"],
      "use": "Notes, messages, descriptions or any text that can exceed one line.",
      "notUse": "The value stays on one line → Input",
      "doc": "atlas/Textarea.md",
      "metadata": "atlas/metadata/Textarea.json"
    },
    {
      "name": "Checkbox",
      "tier": "primitives",
      "status": "stable",
      "import": "@atlas/ui-web/primitives/Checkbox/Checkbox",
      "variants": ["default", "card"],
      "sizes": ["sm", "md", "lg"],
      "use": "Several options can be chosen independently from a list.",
      "notUse": "The choice takes effect immediately without a save → Switch.",
      "doc": "atlas/Checkbox.md",
      "metadata": "atlas/metadata/Checkbox.json"
    },
    {
      "name": "Switch",
      "tier": "primitives",
      "status": "stable",
      "import": "@atlas/ui-web/primitives/Switch/Switch",
      "variants": [],
      "sizes": ["sm", "md", "lg"],
      "use": "A preference or setting takes effect immediately, with no save step.",
      "notUse": "The value is submitted later with a form → Checkbox",
      "doc": "atlas/Switch.md",
      "metadata": "atlas/metadata/Switch.json"
    },
    {
      "name": "Badge",
      "tier": "primitives",
      "status": "stable",
      "import": "@atlas/ui-web/primitives/Badge/Badge",
      "variants": ["neutral", "primary", "success", "warning", "danger", "info"],
      "sizes": ["sm", "md", "lg"],
      "use": "Marking the status of a row or object (Active, Failed, Draft).",
      "notUse": "The user must act on it → Button.",
      "doc": "atlas/Badge.md",
      "metadata": "atlas/metadata/Badge.json"
    },
    {
      "name": "Alert",
      "tier": "compositions",
      "status": "stable",
      "import": "@atlas/ui-web/compositions/Alert/Alert",
      "variants": ["info", "success", "warning", "danger", "neutral"],
      "sizes": ["sm", "md", "lg"],
      "use": "A form-level error, a warning above a step, or a notice that stays in the page flow until the condition clears.",
      "notUse": "A short confirmation of a completed action (\"Saved\") → Toast.",
      "doc": "atlas/Alert.md",
      "metadata": "atlas/metadata/Alert.json"
    },
    {
      "name": "Card",
      "tier": "compositions",
      "status": "stable",
      "import": "@atlas/ui-web/compositions/Card/Card",
      "variants": ["default", "elevated", "outlined", "filled"],
      "sizes": ["sm", "md", "lg"],
      "use": "Grouping related content on a bordered or raised surface: a settings group, summary block, or selectable option.",
      "notUse": "A container used only for spacing → a plain element.",
      "doc": "atlas/Card.md",
      "metadata": "atlas/metadata/Card.json"
    },
    {
      "name": "Dialog",
      "tier": "compositions",
      "status": "stable",
      "import": "@atlas/ui-web/compositions/Dialog/Dialog",
      "variants": ["default", "destructive"],
      "sizes": ["sm", "md", "lg", "xl", "full"],
      "use": "A short focused form or detail view that must not lose the page behind it.",
      "notUse": "A decision that must be made, especially destructive or irreversible, with no close control → AlertDialog.",
      "doc": "atlas/Dialog.md",
      "metadata": "atlas/metadata/Dialog.json"
    },
    {
      "name": "Tabs",
      "tier": "patterns",
      "status": "stable",
      "import": "@atlas/ui-web/patterns/Tabs/Tabs",
      "variants": ["line", "pill", "segmented", "outline"],
      "sizes": ["sm", "md", "lg"],
      "use": "Two to five peer views of the same subject share one page.",
      "notUse": "The views are steps in a sequence → a flow",
      "doc": "atlas/Tabs.md",
      "metadata": "atlas/metadata/Tabs.json"
    },
    {
      "name": "NavBar",
      "tier": "layouts",
      "status": "stable",
      "import": "@atlas/ui-web/layouts/NavBar/NavBar",
      "variants": ["default", "transparent", "bordered", "floating"],
      "sizes": ["sm", "md", "lg"],
      "use": "The app or site needs a persistent top header with brand, primary links and actions.",
      "notUse": "Switching views within a page → Tabs",
      "doc": "atlas/NavBar.md",
      "metadata": "atlas/metadata/NavBar.json"
    },
    {
      "name": "AlertDialog",
      "tier": "compositions",
      "status": "stable",
      "import": "@atlas/ui-web/compositions/AlertDialog/AlertDialog",
      "variants": ["default", "destructive"],
      "sizes": ["sm", "md", "lg"],
      "use": "The user must explicitly confirm or cancel before anything happens: delete, discard, revoke, send to many.",
      "notUse": "Content needs a form, rich body, or an optional close control → Dialog.",
      "doc": "atlas/AlertDialog.md",
      "metadata": "atlas/metadata/AlertDialog.json"
    },
    {
      "name": "Avatar",
      "tier": "primitives",
      "status": "stable",
      "import": "@atlas/ui-web/primitives/Avatar/Avatar",
      "variants": [],
      "sizes": ["xs", "sm", "md", "lg", "xl"],
      "use": "Showing a person or entity beside a name in a list row, comment, header or member list.",
      "notUse": "The avatar must be pressed on its own → wrap it in Button.",
      "doc": "atlas/Avatar.md",
      "metadata": "atlas/metadata/Avatar.json"
    },
    {
      "name": "Breadcrumb",
      "tier": "patterns",
      "status": "stable",
      "import": "@atlas/ui-web/patterns/Breadcrumb/Breadcrumb",
      "variants": [],
      "sizes": [],
      "use": "The page sits two or more levels deep and the user needs to jump back up the hierarchy.",
      "notUse": "Primary site navigation → NavBar",
      "doc": "atlas/Breadcrumb.md",
      "metadata": "atlas/metadata/Breadcrumb.json"
    },
    {
      "name": "Bubble",
      "tier": "primitives",
      "status": "stable",
      "import": "@atlas/ui-web/primitives/Bubble/Bubble",
      "variants": ["primary", "secondary", "muted", "tinted", "outline", "destructive"],
      "sizes": [],
      "use": "Showing one message in a chat, comment thread or assistant conversation.",
      "notUse": "Showing a system or status notice → Alert.",
      "doc": "atlas/Bubble.md",
      "metadata": "atlas/metadata/Bubble.json"
    },
    {
      "name": "ButtonGroup",
      "tier": "compositions",
      "status": "stable",
      "import": "@atlas/ui-web/compositions/ButtonGroup/ButtonGroup",
      "variants": [],
      "sizes": ["sm", "md", "lg"],
      "use": "A few related actions on one object belong together: alignment, view mode, a split action.",
      "notUse": "Actions are unrelated → separate Buttons with spacing.",
      "doc": "atlas/ButtonGroup.md",
      "metadata": "atlas/metadata/ButtonGroup.json"
    },
    {
      "name": "Chart",
      "tier": "compositions",
      "status": "stable",
      "import": "@atlas/ui-web/compositions/Chart/Chart",
      "variants": [],
      "sizes": [],
      "use": "One metric over time or across categories (visitors per day, revenue per month).",
      "notUse": "A single number → Card.",
      "doc": "atlas/Chart.md",
      "metadata": "atlas/metadata/Chart.json"
    },
    {
      "name": "CodeBlock",
      "tier": "compositions",
      "status": "stable",
      "import": "@atlas/ui-web/compositions/CodeBlock/CodeBlock",
      "variants": ["default", "typing"],
      "sizes": ["sm", "md", "lg"],
      "use": "Showing a short, readable snippet, install command, or example in docs or onboarding.",
      "notUse": "The user must edit the text → Textarea.",
      "doc": "atlas/CodeBlock.md",
      "metadata": "atlas/metadata/CodeBlock.json"
    },
    {
      "name": "CommandMenu",
      "tier": "compositions",
      "status": "stable",
      "import": "@atlas/ui-web/compositions/CommandMenu/CommandMenu",
      "variants": [],
      "sizes": ["md", "lg"],
      "use": "The user needs to jump to a page or run an action by typing (opened with Cmd or Ctrl + K).",
      "notUse": "Filtering a page's own content (use the search and filter pattern).",
      "doc": "atlas/CommandMenu.md",